"ID","URL","Titel","Beschreibung","Ort","Typ","Reichweite","Staatlich_Öffentlich","Adresse_Herausgeber","Land","Geodaten","lat","lon"
52,"https://www.moenchengladbach.de/de/aktuell-aktiv/open-data/","Mönchengladbach Open Data","„Die Stadt Mönchengladbach startet im Rahmen ihrer Open Government Bestrebungen dieses Open-Data-Portal.

Nach und nach werden wir den Bestand an offenen Daten erweitern und so eine Grundlage bilden, für einen demokratischen Wissensaustausch, mehr Partizipation und eine bessere Kommunkation zwischen Verwaltung, Politik und Bürgerinnen und Bürgern unserer Stadt.“ (Quelle: Stadt Mönchengladbach, abgerufen am 26.10.2017)","Mönchengladbach","odp","kommunal","ja","Stadt Mönchengladbach, 41050 Mönchengladbach","Deutschland","",51.2031668,6.45409639874154
53,"https://geo.muelheim-ruhr.de/open-data/13819","Mülheim an der Ruhr Open Data","„Die Stadt Mülheim an der Ruhr stellt offene Daten (Open Data) als Rohdaten aus verschiedenen Bereichen der Verwaltung bereit. Eine automatisierte Aktualisierung sorgt dafür, dass stets nur die aktuellsten Daten publiziert werden.“ (Quelle: Stadt Mönchengladbach, abgerufen am 26.10.2017)","Mülheim an der Ruhr","odp","kommunal","ja","Am Rathaus 1, 45468 Mülheim an der Ruhr","Deutschland","",51.4284118,6.8786938
54,"https://www.opengov-muenchen.de/","Open-Data-Portal München der Landeshauptstadt München","„Auf dem Open Data Portal München stellt die Landeshauptstadt München Datensätze der öffentlichen Verwaltung zur Verfügung. Verwaltungsmitarbeitern, Bürgerinnen und Bürgern, Unternehmen und Wissenschaftlern soll damit die Möglichkeit gegeben werden, über einen zentralen Einstiegspunkt auf Daten und Informationen der Verwaltung zuzugreifen und diese weiterzuverwenden, so dass durch neue Ideen sowie Kombination und Analyse neue Erkenntnisse aus den vorhandenen Daten gewonnen werden können.“ (Quelle: Open-Data-Portal München der Landeshauptstadt München, abgerufen am 26.10.2017)","München","odp","kommunal","ja","Landeshauptstadt München, 80313 München","Deutschland","",48.1039099,11.6048638526407
55,"http://www.stadt-muenster.de/katasteramt/geodatenmanagement/open-data.html","Offene Geodaten Münster","„Die Stadt Münster beteiligt sich am Wettbewerb ""Apps für Deutschland"". Sie stellt dazu Datensätze über Spielplätze und Sportstätten als offene Daten zur Verfügung. Die Daten werden mit Stand Dezember 2011 bereitgestellt. Es kommt die Lizenz Creative Commons Namensnennung 3.0 zur Anwendung.“
(Quelle: Stadt Münster, abgerufen am 26.10.2017)","Münster (Westf.)","odp","kommunal","ja","Stadt Münster, 48127 Münster","Deutschland","",51.9018409,7.6735556
56,"http://iatiregistry.org/","Iati Registry","Das internationale Datenportal der „International Aid Transparency Initiative“ (IATI) enthält offene Daten zur Entwicklungszusammenarbeit verschiedener Länder. Zu den Datenanbietern gehört unter anderem das Bundesministerium für wirtschaftliche Zusammenarbeit und Entwicklung (BMZ) (Stand: 22.6.2018)","Weltweit","odp","international","nein","","Deutschland","",52.5243681651,13.4105300903
57,"https://transparenz.karlsruhe.de/","Karlsruhe Open Data","Zentrale Anlaufstelle für offene Daten und Dokumente der Stadt Karlsruhe:

„Auf diesem Portal finden Sie sowohl Dokumente und Berichte, als auch maschinenlesbare Datensätze (""open data""). Diese Informationen dürfen Sie - unter einigen wenigen Bedingungen - kostenfrei weitergeben, bearbeiten und auch kommerziell nutzen. Wir freuen uns, wenn daraus interessante Projekte entstehen - und wenn Sie uns von Ihrem Projekt erzählen. Das Informationsangebot wird laufend erweitert.“
(Quelle: Stadt Karlsruhe, abgerufen am 27.10.2017)
","Karlsruhe","odp","kommunal","ja","Stadt Karlsruhe, Karl-Friedrich-Str. 10, 76133 Karlsruhe ","Deutschland","",49.00862575,8.40324575770885
58,"https://www.offenesdatenportal.de/organization/krzn","Kommunales Rechenzentrum Niederrhein","Offene Daten des Kommunalen Rechenzentrums Niederrhein (KRZN) mit Sitz in Kamp-Lintfort. Das KRZN ist ein kommunaler Zweckverband un IT-Dienster für Stadt Bottrop, Stadt Krefeld, Kreis Kleve, Kreis Viersen und Kreis Wesel. 25 Datensätze gruppiert nach den Themen „Wirtschaft und Arbeit“, „Öffentliche Verwaltung“ und „Geographie, Geologie und Geobasisdaten“ (Stand: 27.10.2017)","Niederrhein","odp","kommunal","ja","Friedrich-Heinrich-Allee 130, 47475 Kamp-Lintfort","Deutschland","ja",51.4872069,6.5467271
59,"https://www.geodaten.niedersachsen.de","GDI Niedersachsen","Informationsplattform zum Thema Geodaten des Landes Niedersachsen. 

Ansprechpartner für das Geoportal und die Geodateninfrastruktur des Landes ist die Koordinierungsstelle GDI-NI beim Landesamt für Geoinformation und Landesvermessung Niedersachsen (LGLN) - Landesvermessung und Geobasisinformation mit Sitz in Hannover. (Stand: 27.10.2017)","Niedersachsen","gdi","regional","ja","Podbielskistraße 331, 30659 Hannover","Deutschland","ja",52.4072985,9.8019451
60,"https://www.geoportal.nrw/","GDI NRW","Die Geodateninfrastruktur des Landes Nordrhein-Westfalen besteht seit 1999 und hat sich die Aktivierung des Geodatenmarktes sowie die verbesserte Verfügbarkeit und Nutzbarkeit der behördlichen und privaten Geodaten zum Ziel gesetzt. An der Realisierung der GDI sind das Land NRW, Kommunen, IT-Unternehmen und Nutzer von Geoinformationen beteiligt.
(Stand: 27.10.2017)","Nordrhein-Westfalen","gdi","regional","ja","Muffendorfer Str. 19-21, 53177 Bonn ","Deutschland","ja",50.675484,7.1574464
61,"http://offenedaten.kdvz-frechen.de/","Offene Daten kdvz Rhein-Erft-Rur","Im Rahmen des Pilotprojektes „Kommunales Open Government in NRW“ realisiert die kdvz Rhein-Erft-Ruhr gemeinsam mit 24 Kommunen und der Open Knowledge Foundation ein sog. „interkommunales Transparenzportal für Gremiendaten“.

Die beteiligten Kommunen sind:
Stadt Kerpen, Gemeinde Kall, Stadt Brühl, Kreis Euskirchen, Stadt Elsdorf, Stadt Bergheim, Gemeinde Langerwehe, Gemeinde Hürtgenwald, Gemeinde Vettweiß, Stadt Jülich, Gemeinde Merzenich, Stadt Wesseling, Stadt Heimbach, Gemeinde Kreuzau, Stadt Linnich, Stadt Bad Münstereifel, Gemeinde Titz, Stadt Bedburg
(Stand: 27.10.2017)","Nordrhein-Westfalen","odp","kommunal","ja","Bonnstraße 16-18, 50226 Frechen","Deutschland","",50.9127371,6.82781069933501
62,"https://open.nrw/","Open Data | Open.NRW","Open.NRW unterstützt Verwaltungen, Bürgerinnen und Bürger des Landes Nordrhein-Westfalen sowie weitere externe Akteure bei dem offenen Austausch und der Zusammenarbeit. Das Landesportal vereint offene Datensätze von Städten und Kommunen und beinhaltet zudem Geobasisdaten. (Stand: 27.10.2017)","Nordrhein-Westfalen","odp","regional","ja","Friedrichstraße 62-80, 40217 Düsseldorf","Deutschland","ja",51.218495,6.7769184
63,"http://www.geoportal.rlp.de/","GDI Rhein­land-Pfalz","Über das GeoPortal.rlp können Geodaten des Landes Rheinland-Pfalz zentral gesucht und visualisiert werden. Es handelt sich um ein Projekt des Lenkungsausschuss für Geodateninfrastruktur Rheinland-Pfalz, dessen Mitglieder Vertreter der Staatskanzlei, der Ministerien und der kommunalen Spitzenverbände sind. Das Portal selbst ist als Open-Source Projekt realisiert, wovon ausgewählte Komponenten unter anderem als LiveCD heruntergeladen werden können. (Stand: 27.10.2017)","Rhein­land-Pfalz","gdi","regional","ja","Von-Kuhl-Str. 49, 56070 Koblenz","Deutschland","ja",50.3750314,7.58472409095872
64,"https://daten.rlp.de/","Open-Government-Data-Portal Rheinland-Pfalz  (OGDP-RP)","Das Portal bietet einen einheitlichen, zentralen Zugang zu Verwaltungsdaten der rheinland-pfälzischen Landesbehörden und Kommunen. Unbedingt zu beachten ist, dass neben den offenen Daten hier auch Daten mit eingeschränkten Lizenzbedingungen angeboten werden, obgleich die Verwendung offener Lizenzen und maschinenlesbarer Rohdaten allgemein angestrebt wird. (Stand: 27.10.2017)","Rheinland-Pfalz","odp","regional","ja","Schillerplatz 3 – 5, 55116 Mainz","Deutschland","",49.9977876,8.2678636
65,"http://geoportal.saarland.de/","GeoPortal Saarland (GDI-SL)","Das GeoPortal Saarland ist die Informations- und Interaktionsplattform der Geodateninfrastruktur Saarland (GDI-SL). Mithilfe von Netzwerk- und Geodiensten ermöglicht diese einen zentralen Zugang zu raumbezogenen Informationen im Saarland. Die Daten werden je zu verschiedenen Nutzungsbedingungen angeboten, einige davon sind frei, andere sind Zugangsbeschränkt. Zu beachten ist dabei die Legende der Inhaltsübersicht und die genauen Angaben in den Metadaten. (Stand: 27.10.2017)","Saarland","gdi","regional","ja","Von der Heydt 22, 66115 Saarbrücken","Deutschland","ja",49.27743135,6.95079331127105
66,"http://www.gdi.sachsen.de/","GDI Sachsen","Die Geodateninfrastruktur Sachsen hat das Ziel, digitalen, raumbezogenen Daten aus der Wirtschaft und öffentlichen Verwaltung des Landes einem breiten Nutzerkreis zugänglich zu machen. Die suche nach Geodaten wird über den Metadatenkatalog GeoMIS.Sachsen und das Geoportal Sachsenatlas ermöglicht. 
(Stand: 27.10.2017)","Sachsen","gdi","regional","ja","Olbrichtplatz 3, 01099 Dresden","Deutschland","ja",51.0768993,13.7596144041686
67,"http://www.opendata.sachsen.de","Open Data - Verfügbare Datenbestände des Freistaats Sachsen","Im Zuge des Projektes „Open Government Data“ wird angestrebt, die Transparenz staatlichen handelns zu erhöhen, in dem mehr Daten aus dem staatlichen Bereich publiziert werden. Die Webseite verweist auf diverse Datenbestände, die zukünftig erschlossen werden könnten. Die Nutzungsbedingungen und Urheberrechtsfragen sind aber bislang noch nicht einheitlich geregelt.
(Stand: 27.10.2017)","Sachsen","odp","regional","ja","Riesaer Straße 7, Haus D, 01129 Dresden","Deutschland","",51.08341095,13.7236239437709
68,"http://www.lvermgeo.sachsen-anhalt.de/de/main.htm","GDI Sachsen-Anhalt / LvermGeo","Die Website des Landesamt für Vermessung und Geoinformation Sachsen-Anhalt umfasst Zugänge zu Diensten der Geodateninfrastruktur Sachsenanhalt (GDI-LSA) sowie einen Geodatenviewer. Viele der angebotenen Dienste und Daten sind käuflich zu erwerben oder unterliegen Nutzungsbeschränkungen.
(Stand: 27.10.2017)","Sachsen-Anhalt","gdi","regional","ja","Otto-von-Guericke-Straße 15, 39104 Magdeburg","Deutschland","ja",52.1296222,11.6308547
69,"https://offenedaten.de/organization/salzgitter","Salzgitter auf OffeneDaten.de","OffeneDaten.de registriert von der Stadt Salzgitter 9 offene Datensätze aus den Kategorien „Öffentliche Verwaltung“, „Kultur, Freizeit, Sport und Tourismus“, sowie „Geographie, Geologie und Geobasisdaten“ (Stand: 8.2.2018)","Salzgitter","odp","kommunal","nein","Stadt Salzgitter, Joachim-Campe-Straße 6 - 8, 38226 Salzgitter","Deutschland","",52.1549617,10.3264841
70,"http://www.gdi-sh.de/","GDI Schleswig-Holstein","Die Geodateninfrastruktur Schleswig-Holstein ermöglicht unter der Leitung des Lenkungsgremiums LG GDI-SH den Zugriff auf Geodaten des Landes Schleswig-Holstein. Die website umfasst ein Geoportal, welches das suchen und Betrachten von Geodaten, nach Themen unterteilt, ermöglicht. Zudem werden kommerzielle Dienste angeboten. (Stand: 27.10.2017)","Schleswig-Holstein","gdi","regional","ja","Düsternbrooker Weg 92, 24105 Kiel","Deutschland","ja",54.3362847,10.155210553726
71,"http://www.geoportal-th.de/","GDI Thüringen","Die Geodateninfrastruktur (GDI) des Landes Thüringen ermöglicht den zugriff auf Geodaten und Dienste des Landes. Neben einem umfrangreichen Downloadbereich von offenen Geodaten ist der Zugriff auf eine Metadatensuche, Web-Viewer, Geoproxy und OGC-Dienste sowie versichiedene Temenbereiche möglich. (Stand: 27.10.2017)","Thüringen","gdi","regional","ja","Landesamt für Vermessung und Geoinformation, Hohenwindenstr. 13 a, D-99086 Erfurt","Deutschland","ja",51.0029703,11.0301267
72,"http://www.geoportal-th.de/de-de/downloadbereiche/downloadoffenegeodatenth%C3%BCringen.aspx","Download Offene Geodaten Thüringen","Teil des Geoportal-Th und der GDI-Th ist ein Downloadbereich, in dem eine Vielzahl von Geodaten ohne Zugangsbeschränkung genutzt und heruntergeladen werden können. Zu beachten ist, dass die Datenlizenz einen Quellenvermerk vorschreibt. (Stand: 27.10.2017)","Thüringen","odp","regional","ja","Landesamt für Vermessung und Geoinformation, Hohenwindenstr. 13 a, D-99086 Erfurt","Deutschland","ja",51.0029703,11.0301267
73,"http://daten.ulm.de/","daten.ulm.de","„daten.ulm.de ist eine Infoplattform für (offene) Geodaten und offene statistische Daten der Stadt Ulm.  Welche Geodaten und Karten gibt es bei der Stadt Ulm in welcher Aktualität? Wer ist Ansprechpartner? Welche offenen Daten kann ich sofort herunterladen und weiterverwenden?  Stöbern Sie einfach im thematisch gegliederten Datenkatalog, dessen Angebot sukzessive ausgebaut wird.“ (Quelle: daten.ulm, abgerufen am 27.10.2017)","Ulm","odp","kommunal","ja","Stadt Ulm, Marktplatz 1, 89073 Ulm","Deutschland","",48.3968458,9.9933699
74,"https://www.offenesdatenportal.de/organization/kreis-viersen","Kreis Viersen Open Data","Offene Verwaltungsdaten des Kreises Viersen (Stand: 22.6.2018)","Viersen","odp","kommunal","ja","Rathausmarkt 3, 41747 Viersen","Deutschland","",51.2589946,6.3930083
75,"https://www.offenesdatenportal.de/organization/stadt-wesel","Stadt Wesel am Rhein Open Data","Offene Verwaltungsdaten der Stadt Wesel  (Stand: 22.6.2018)","Wesel","odp","kommunal","ja","Stadt Wesel, Klever-Tor-Platz 1, 46483 Wesel","Deutschland","",51.65888825,6.61112660507015
76,"https://www.offenedaten-wuppertal.de/","Offene Daten Wuppertal","Offene Daten der Stadt Wuppertal  (Stand: 22.6.2018)","Wuppertal","odp","kommunal","ja","Johannes-Rau-Platz 1, 42275 Wuppertal","Deutschland","",51.27215575,7.20012974620937
77,"https://open-data.europa.eu/de/about","Offenes Datenportal der EU","“Das Offene Datenportal der Europäischen Union bietet Zugang zu einer wachsenden Menge von Daten über die Organe und sonstigen Einrichtungen der Europäische Union (EU).” (Quelle: Europäische Union, abgerufen am 7.11.2017)","Europa","odp","international","ja","","Europa","",48.5948367,7.7719195
78,"http://data.graz.gv.at/","Graz Open Data","Graz Online - Stadtportal der Landeshauptstadt Graz  (Stand: 22.6.2018)","Graz","odp","kommunal","ja","Stadt Graz, Rathaus, 8011 Graz","Österreich","",47.0703682,15.4382920305677
79,"http://data.ktn.gv.at/","Kärnten Open Data","Datenauftritt des Bundeslandes Kärnten (Stand: 22.6.2018)","Kärnten","odp","regional","ja","Arnulfplatz 1, A-9021 Klagenfurt/Wörthersee","Österreich","",46.6210806,14.3115056652442
80,"http://data.linz.gv.at/","Linz Open Data","Datenauftritt der Stadt Linz  (Stand: 22.6.2018)","Linz","odp","kommunal","ja","Hauptplatz 1, 4041 Linz","Österreich","",48.3060622,14.2869766468633
81,"http://opendataportal.at/","Open Data Portal Österreich","Das zentrale Datenportal für Wirtschaft, Kultur, NGO/NPO, Forschung und Zivilgesellschaft. Betrieben durch Wikimedia Österreich  (Stand: 22.6.2018)","Österreich","odp","national","nein","Stolzenthalergasse 7/1, 1080 Wien","Österreich","",48.2088201,16.3417422
82,"http://data.noe.gv.at/","Niederösterreich (lower Austria) Open Data","Katalog von OGD-Datensätzen des Landes Niederösterreich  (Stand: 22.6.2018)","Niederösterreich","odp","regional","ja","Landhausplatz 1, Haus 13, 3109 St. Pölten","Österreich","",48.2030858,15.63227965
83,"http://basemap.at/","Austrian Ogd Basemap","Basemap.at ist eine internetfähige Grundkarte von Österreich, basierend auf den Geodaten der Länder und deren Partnern, frei verfügbar und performant.  (Stand: 22.6.2018)","Österreich","odp","national","ja","Stadt Wien","Österreich","ja",48.2123678,16.4332434
84,"https://www.geologie.ac.at/","Geologische Bundesanstalt","Die Geologische Bundesanstalt (GBA) ist das größte geowissenschaftliche Forschungszentrum Österreichs. Es werden INSPIRE-Konforme Such-, Darstellungs- und Downloaddienste sowie Webapplikationen uns Services bereitgestellt.  (Stand: 22.6.2018)","Österreich","odp","national","ja","Neulinggasse 38, 1030 Wien","Österreich","ja",48.200406,16.3853646
85,"http://inspire.gv.at/","INSPIRE Austria","Website von INSPIRE Österreich mit Geoportalen und Informationen zur landesweiten Geodateninfrastruktur  (Stand: 22.6.2018)","Österreich","gdi","national","nein","Hintere Zollamtsstraße 4, A-1030 Wien","Österreich","ja",48.20876485,16.3859661480486
86,"http://zamg.ac.at/","Zentralanstalt für Meteorologie und Geodynamik","Wetter, Klima, Umwelt, Geophysik, Forschung und Produkte der Zentralanstalt für Meteorologie und Geodynamik  (Stand: 22.6.2018)","Österreich","odp","national","ja","Hohe Warte 38, A-1190 Wien","Österreich","ja",48.2485021,16.3556787
87,"http://data.gv.at/","http://data.gv.at/ - Offene Daten Österreichs","Als zentraler “Österreich”-Katalog soll diese Website die Metadaten der dezentralen Metadatenkataloge der Verwaltung aufnehmen und abrufbar halten. Es handelt sich insbesondere um Open Government-Informationen (OGD) und Informationen des öffentlichen Sektors (IWG)  (Stand: 22.6.2018)","Österreich","odp","national","ja","Bundeskanzleramt, Ballhausplatz 2, A-1010 Wien","Österreich","",48.2083986,16.3637884
88,"http://umweltbundesamt.at/opendata/","Umweltbundesamt: OpenData Portal","Offene Umweltdaten des Umweltbundesamtes Österreich (Stand: 22.6.2018)","Österreich","umw","national","ja","Spittelauer Lände 5, A-1090 Wien","Österreich","",48.22719855,16.3636329752567
89,"http://data.reeep.org/","Linked Clean Energy Data - Data.reegle.info","Offene daten der internationalen organisation REEP (Renewable Energy and Energy Efficiency Partnership) u.a. zum Thema „clean energy (English)“ als Linked Open Data  (Stand: 22.6.2018)","Österreich","odp","international","nein","Wagramerstrasse 5, A-1400 Wien","Österreich","",48.23482845,16.416841737611
90,"http://statistik.at/","Statistik Austria","Amtliche Statistiken der Bundesanstalt Statistik Österreich (Stand: 12.2.2018)","Österreich","stat","national","nein","A-Guglgasse 13, 1110 Wien ","Österreich","",48.1857192,16.4221587
91,"http://data.tirol.gv.at/","Tirol Data Portal","Open Government Data des Landes Tirol, Österreich (Stand: 12.3.2018)","Tirol","odp","regional","ja"," Eduard-Wallnöfer-Platz 3, 6020 Innsbruck ","Österreich","",47.26432415,11.3961588301775
92,"http://data.vorarlberg.gv.at/","Vorarlberg Open Data","Open Government Data des Landes Voralberg (Stand: 12.3.2018)","Voralberg","odp","regional","ja","Römerstraße 15, A-6901 Bregenz","Österreich","",47.5008317,9.74510994591155
93,"http://data.wien.gv.at/","Open Government Data Wien","Datenauftritt der Bundeshauptstadt (und zugleich Bundesland) Wien (Stand: 12.3.2018)","Wien","odp","regional","ja","Ballhausplatz 2, A-1010 Wien","Österreich","",48.2083986,16.3637884
94,"http://ge.ch/sitg/sitg_catalog/sitg_donnees","Sitg Geneva's Territorial Information System","Geoinformationen des Kanton und der Republik Genf (Französisch-Sprachig) (Stand: 12.3.2018)","Genf","odp","regional","nein","Rue des Gazomètres 7, CH-1211 Genève 8","Schweiz","ja",46.2017332,6.1334897
95,"http://data.tpg.ch/","Open Data TPG","Offene Daten der Transports Publics Genevois (TPG), eines öffentlichen Verkehrsunternehmen des Kantons Genf (Französisch-Sprachig) (Stand: 12.3.2018)","Genf","odp","regional","nein","route de la Chapelle 1, CH-1212 Grand-Lancy 2","Schweiz","",46.1673104,6.140133
96,"http://opendata.cern.ch/","Cern Open Data","Offene Daten der Europäischen Organisation für Kernforschung (CERN) in englischer Sprache (Stand: 12.3.2018)","Schweiz","for","international","nein","CH-1211 Geneva 23","Schweiz","",46.2017559,6.1466014
97,"http://meteoswiss.ch/","Bundesamt für Meteologie und Klimatologie Meteoschweiz","Klima- und Wetterdaten, Prognosen und Kartenvisualisierungen des Bundesamt für Meteologie und Klimatologie, Schweiz (Stand: 12.3.2018)","Schweiz","odp","national","ja","CH-8058 Zürich-Flughafen","Schweiz","",47.4502948,8.5622313
98,"http://www.bfs.admin.ch/","Bundesamt für Statistik","Amtliche Statistiken der Schweiz (Stand: 12.3.2018)","Schweiz","stat","national","ja","Espace de l'Europe 10, CH-2010 Neuchâtel","Schweiz","",46.99853575,6.94218174861091
99,"https://opendata.swiss","opendata.swiss","opendata.swiss ist das Portal für Schweizer Open Government Data (OGD). Hier können Sie Schweizer Behördendaten kostenlos herunterladen. (Stand: 12.3.2018)","Schweiz","odp","national","ja","Archivstrasse 24, 3003 Bern","Schweiz","",46.94037855,7.4465666081607
100,"https://data.stadt-zuerich.ch/","Zürich Open Data","Datenkatalog mit über 300 Datensätzen der Stadt Zürich, geordnet nach 19 Kategorien (Stand: 9.1.2018)","Zürich","odp","kommunal","ja","Stadthausquai 17, CH-8001 Zürich","Schweiz","",47.3692542,8.5413776
101,"https://www.bmlfuw.gv.at/service/geo-informationen.html","GIS-Anwendungen des BMLFUW","Geoinformationsdaten im Rahmen der GIS-Anwendungen des österreichischen Bundesministeriums für Land- und Forstwirtschaft, Umwelt und Wasserwirtschaft (BMLFUW) (Stand: 12.3.2018)","Österreich","odp","national","ja","Stubenring 1, 1010 Wien","Österreich","ja",48.20980085,16.3836676498245
102,"http://www.austrianmap.at","AMAP Austria – BEV – Bundesamt für Eich- und Vermessungswesen","Austrian Map online ist ein Service des Bundesamtes für Eich- und Vermessungswesens Österreich. Das WebGIS enthält Webkarten, die Geographischen Namensdatenbank GEONAM  und eine @map-Funktion zur Platzierung von Symbolen in der Karte u.a. (Stand: 12.3.2018)","Österreich","gdi","national","ja","Schiffamtsgasse 1-3, 1020 Wien ","Österreich","ja",48.218675,16.3730461
103,"http://www.geoland.at/","geoland.at – Geodatenportal der österreichischen Länder","GEOLAND.AT - Das Geodatenportal der österreichischen Länder ist Teil nationaler und internationalen Geodateninfrastrukturen (GDI), die die Nutzung von öffentlichen Geodaten für Verwaltung, Wirtschaft, Forschung, Bildung und Bürger wesentlich erleichtern sollen. (Stand: 12.3.2018)","Österreich","gdi","national","ja","","Österreich","ja",47.516231,14.550072
104,"http://www.doris.at/","DORIS interMAP – Startseite","DORIS ist das Digitale Oberösterreichische RaumInformationssystem - das Geographische Informationssystem des Landes Oberösterreich. (Stand: 12.3.2018)","Oberösterreich","gdi","regional","ja","Bahnhofplatz 1, 4021 Linz","Österreich","ja",48.2925794,14.2920399
105,"http://www.noe.gv.at/Land-Zukunft/Karten-Geoinformation.html","Karten und Geoinformationen - Land Niederösterreich","Portal zur Geodateninfrastruktur des Landes Niederösterreich mit Zugang zum NÖ Atlas und einen Downloadbereich mit frei verwendbaren Geodaten (mit Quellenangabe) (Stand: 7.11.2017)","Niederösterreich","gdi","regional","ja","Landhausplatz 1, 3109 St. Pölten","Österreich","ja",48.201189,15.6335582626124
106,"http://www.salzburg.gv.at/sagis/","SAGIS - Salzburger Geographisches Informationssystem","WebGIS, Geodaten und Dienste des Landes Salzburg, Österreich (Stand: 12.3.2018)","Salzburg","gdi","regional","ja","Chiemseehof, 5010 Salzburg","Österreich","ja",47.7978139,13.0501183
107,"http://service.salzburg.gv.at/ogd/client/","Open Government Data Salzburg","Offene Datensätze des Landes Salzburg (Stand: 12.3.2018)","Salzburg","odp","regional","ja","Chiemseehof, 5010 Salzburg","Österreich","ja",47.7978139,13.0501183
108,"http://www.wien.gv.at/viennagis/","ViennaGIS - das Geografische Informationssystem der Stadt Wien","Das Geografische Informationssystem (GIS) der Stadt Wien stellt eine umfassende und nachhaltige Geodaten- und Geodinste-Infrastruktur bereit (Stand: 8.11.2017)","Wien","gdi","regional","ja","Stadt Wien","Österreich","ja",48.2123678,16.4332434
109,"http://gis.bgld.gv.at/","GeoDaten Burgenland - Willkommen","Geodaten und -Dienste des Burgenlandes in Östereich, u.a. mit Downloads, WMS Diensten und WebGIS-Inhalten wie eine Katastralmappe, Topografische Landkarte und ein Flächenwidmungsplan (Stand: 8.11.2017)","Burgenland","gdi","regional","ja","Europaplatz 1, A-7000 Eisenstadt ","Österreich","ja",47.84905785,16.5285640256111
110,"http://www.vorarlberg.at/lvg","Land Vorarlberg - Landesvermessungsamt","Geodaten und -Dienste des Landes Voralberg, Östereich, u.a. mit Downloads, WMS Diensten, dem Voralberg Atlas und dem Voralberg Atlas Mobil (Stand: 8.11.2017)","Voralberg","gdi","regional","ja","Römerstraße 15, 6901 Bregenz","Österreich","ja",47.5008317,9.74510994591155
111,"http://www.tirol.gv.at/tiris","tiris - Tiroler Rauminformationssystem | Land Tirol","“tiris ist das geografische Informationssystem des Landes Tirol. In den Verwaltungsbereichen werden Geodaten über raumbezogene Sachverhalte im tiris Datenpool systematisch gespeichert. Daraus entstehen Geoinformationen wie tirisMaps und Geodatendienste für die amtliche und öffentliche Nutzung im Internet.” (Quelle: tiris, abgerufen am 7.11.2017)","Tirol","gdi","regional","ja","Eduard-Wallnöfer-Platz 3, 6020 Innsbruck","Österreich","ja",47.26432415,11.3961588301775
112,"http://www.kagis.ktn.gv.at/","GDI Kärnten – KAGIS","Portal zur Geodateninfrastruktur der Landesregierung Kärnten (Stand: 12.3.2018)","Kärnten","gdi","regional","ja","Flatschacher Straße 70, 9021 Klagenfurt am Wörthersee","Österreich","ja",46.6123146,14.3176085781973
113,"http://www.gis.steiermark.at/","GIS-Steiermark - Geographisches Informationssystem -  Land Steiermark","Das GIS-Steiermark versteht sich als öffentliche Serviceeinrichtung und stellt raumbezogene Daten und daraus generierte Mehrwertprodukte als Planungsgrundlagen der Landesverwaltung und Externen zur Verfügung. (Stand: 8.11.2017)","Steiermark","gdi","regional","ja","Hofgasse 16, 8010 Graz  ","Österreich","ja",47.0722916,15.4413598
